{"self":"flow_launcher","timestamp":1784981312.5053179,"nodes":[{"name":"flowsim","version":"2.0.0","description":"FlowSim v2 simulation world (C++ flowcoro + esmini RoadManager)","pid":18853,"alive":true,"topics":[{"topic":"control/cmd","role":"sub","caps":2},{"topic":"vehicle/state","role":"pub","caps":1},{"topic":"road/geometry","role":"pub","caps":1},{"topic":"road/traffic_lights","role":"pub","caps":1},{"topic":"road/ref_path","role":"pub","caps":1},{"topic":"sim/tick","role":"pub","caps":1},{"topic":"sim/collision","role":"pub","caps":1},{"topic":"scene/frame","role":"pub","caps":1}]},{"name":"sensor_model","version":"1.0.0","description":"Noisy/FOV/occlusion sensor model","pid":18853,"alive":true,"topics":[{"topic":"vehicle/state","role":"sub","caps":2},{"topic":"sensor/lidar","role":"pub","caps":1},{"topic":"sensor/gps","role":"pub","caps":1},{"topic":"sensor/camera","role":"pub","caps":1}]},{"name":"perception","version":"1.0.0","description":"LiDAR/GPS/Camera simulation + DBSCAN clustering [FlowCoro]","pid":18853,"alive":true,"topics":[{"topic":"vehicle/state","role":"sub","caps":2},{"topic":"sensor/lidar","role":"sub","caps":2},{"topic":"perception/obstacles","role":"pub","caps":1}]},{"name":"fusion","version":"1.0.0","description":"EKF 5D sensor fusion (LiDAR + GPS + SLAM Pose2D) [FlowCoro]","pid":18853,"alive":true,"topics":[{"topic":"sensor/lidar","role":"sub","caps":2},{"topic":"sensor/gps","role":"sub","caps":2},{"topic":"sensor/pose","role":"sub","caps":2},{"topic":"fusion/localization","role":"pub","caps":1},{"topic":"fusion/latency","role":"pub","caps":1}]},{"name":"planning","version":"1.0.0","description":"Frenet Optimal Trajectory Planner [FlowCoro]","pid":18853,"alive":true,"topics":[{"topic":"fusion/localization","role":"sub","caps":2},{"topic":"perception/obstacles","role":"sub","caps":2},{"topic":"road/geometry","role":"sub","caps":2},{"topic":"road/traffic_lights","role":"sub","caps":2},{"topic":"scene/frame","role":"sub","caps":2},{"topic":"planning/trajectory","role":"pub","caps":1}]},{"name":"control","version":"1.0.0","description":"PID longitudinal controller + ACC [FlowCoro]","pid":18853,"alive":true,"topics":[{"topic":"fusion/localization","role":"sub","caps":2},{"topic":"planning/trajectory","role":"sub","caps":2},{"topic":"vehicle/state","role":"sub","caps":2},{"topic":"road/geometry","role":"sub","caps":2},{"topic":"road/ref_path","role":"sub","caps":2},{"topic":"scene/frame","role":"sub","caps":2},{"topic":"control/raw_cmd","role":"pub","caps":1}]},{"name":"safety_control","version":"1.0.0","description":"FlowCoro safety envelope for control commands","pid":18853,"alive":true,"topics":[{"topic":"control/raw_cmd","role":"sub","caps":2},{"topic":"fusion/localization","role":"sub","caps":2},{"topic":"perception/obstacles","role":"sub","caps":2},{"topic":"control/cmd","role":"pub","caps":1}]},{"name":"inference","version":"2.1.0","description":"On-vehicle MLP inference (v2: 16-dim + OTA hot-reload) [FlowCoro]","pid":18853,"alive":true,"topics":[{"topic":"fusion/localization","role":"sub","caps":2},{"topic":"planning/trajectory","role":"sub","caps":2},{"topic":"perception/obstacles","role":"sub","caps":2},{"topic":"control/cmd","role":"sub","caps":2},{"topic":"model_ota/active","role":"sub","caps":2},{"topic":"road/traffic_lights","role":"sub","caps":2},{"topic":"road/geometry","role":"sub","caps":2},{"topic":"inference/trajectory","role":"pub","caps":1},{"topic":"inference/assist","role":"pub","caps":1},{"topic":"inference/raw_cmd","role":"pub","caps":1}]},{"name":"data_recorder","version":"1.0.0","description":"Training sample recorder (imitation learning JSONL)","pid":18853,"alive":true,"topics":[{"topic":"fusion/localization","role":"sub","caps":2},{"topic":"planning/trajectory","role":"sub","caps":2},{"topic":"perception/obstacles","role":"sub","caps":2},{"topic":"control/cmd","role":"sub","caps":2}]},{"name":"learner","version":"1.0.0","description":"On-vehicle incremental SGD fine-tuning (Stage 3)","pid":18853,"alive":true,"topics":[{"topic":"fusion/localization","role":"sub","caps":2},{"topic":"planning/trajectory","role":"sub","caps":2},{"topic":"perception/obstacles","role":"sub","caps":2},{"topic":"control/cmd","role":"sub","caps":2},{"topic":"learner/status","role":"pub","caps":1}]},{"name":"model_ota","version":"1.0.0","description":"Model OTA + version management with A-B testing (Stage 4)","pid":18853,"alive":true,"topics":[{"topic":"model_ota/cmd","role":"sub","caps":2},{"topic":"fusion/localization","role":"sub","caps":2},{"topic":"model_ota/active","role":"pub","caps":1},{"topic":"model_ota/status","role":"pub","caps":1},{"topic":"model_ota/ab_result","role":"pub","caps":1}]},{"name":"monitor","version":"1.0.0","description":"System monitor + dashboard JSON exporter","pid":18853,"alive":true,"topics":[{"topic":"perception/obstacles","role":"sub","caps":2},{"topic":"vehicle/state","role":"sub","caps":2},{"topic":"fusion/latency","role":"sub","caps":2},{"topic":"flowengine/node_info","role":"sub","caps":2},{"topic":"planning/trajectory","role":"sub","caps":2},{"topic":"road/geometry","role":"sub","caps":2},{"topic":"scene/frame","role":"sub","caps":2},{"topic":"traffic/traffic_lights","role":"sub","caps":2}]}],"metrics":{"bus":{"published":976,"delivered":2226,"dropped":0},"transport":{"local_pub":976,"remote_pub":0},"scheduler":{"tasks":5,"mode":"CHOREO"},"latency":{"avg_us":0,"p50_us":0,"p99_us":0},"driver_mode":"CP:READY","route_lane":-1,"topics":[{"topic":"vehicle/state","pub":73,"del":219,"drop":0,"lat_us":780,"freq":75.5155617683269,"subs":3},{"topic":"road/geometry","pub":2,"del":8,"drop":0,"lat_us":30,"freq":0.44870696115005387,"subs":4},{"topic":"road/traffic_lights","pub":73,"del":146,"drop":0,"lat_us":1490,"freq":75.3525712210847,"subs":2},{"topic":"scene/frame","pub":73,"del":219,"drop":0,"lat_us":804,"freq":75.693244072508335,"subs":3},{"topic":"sim/tick","pub":73,"del":0,"drop":0,"lat_us":0,"freq":74.8943270853457,"subs":0},{"topic":"sim/collision","pub":0,"del":0,"drop":0,"lat_us":0,"freq":0,"subs":0},{"topic":"sensor/lidar","pub":61,"del":183,"drop":0,"lat_us":1086,"freq":18.881555016961094,"subs":3},{"topic":"sensor/gps","pub":31,"del":62,"drop":0,"lat_us":1610,"freq":9.46191823151946,"subs":2},{"topic":"sensor/camera","pub":21,"del":0,"drop":0,"lat_us":0,"freq":6.2489745194609876,"subs":0},{"topic":"fusion/localization","pub":63,"del":441,"drop":0,"lat_us":267,"freq":28.968215474988064,"subs":7},{"topic":"planning/trajectory","pub":36,"del":180,"drop":0,"lat_us":557,"freq":12.169764246449994,"subs":5},{"topic":"control/raw_cmd","pub":58,"del":58,"drop":0,"lat_us":703,"freq":19.392184809656193,"subs":1},{"topic":"control/cmd","pub":48,"del":237,"drop":0,"lat_us":444,"freq":30.028321099014128,"subs":5},{"topic":"inference/trajectory","pub":53,"del":0,"drop":0,"lat_us":0,"freq":16.843082802512345,"subs":0},{"topic":"learner/status","pub":1,"del":0,"drop":0,"lat_us":0,"freq":0,"subs":0},{"topic":"model_ota/active","pub":0,"del":0,"drop":0,"lat_us":0,"freq":0,"subs":0}],"vehicle":{"speed":9.72396836585772,"target_speed":15,"throttle":0.21007457375526428,"brake":0,"x":42.552665511423847,"error":5.27603163414228},"scene":{"schema_version":"1.0.0","ego":{"x":42.552665511423847,"y":-1.8833043898556592,"heading":0.0329034234898435,"speed":9.72396836585772,"steer":0.030677249655127525,"lights":16,"brake":0,"throttle":0.21007457375526428,"vx":9.7187050851401739,"vy":0.31989412040888215,"target_vx":15,"length":4.6,"width":2,"ai_state":"cruise"},"lane":{"width":3.5,"count":4,"center":0},"road_network":{"edges":[{"id":0,"name":"0","nodes":[[0,0,0],[1428.5714285714287,0,0],[2857.1428571428573,0,0],[4285.7142857142853,0,0],[5714.2857142857147,0,0],[7142.8571428571431,0,0],[8571.42857142857,0,0],[10000,0,0]],"lanes":4,"lane_width":3.5,"oneway":false,"length":10000,"type":"highway"}]},"entities":[{"type":"ego","id":0,"x":42.552665511423847,"y":-1.8833043898556592,"heading":0.0329034234898435,"speed":9.72396836585772,"steer":0.030677249655127525,"throttle":0.21007457375526428,"brake":0,"length":4.6,"width":2,"target_vx":15,"vx":9.7187050851401739,"vy":0.31989412040888215,"lights":16,"ai_state":"cruise"},{"type":"car","id":1,"x":149.21487221630667,"y":-3.5000000000008749,"heading":0,"speed":8.0219393078570356,"length":4.6,"width":2,"ai_state":"cruise","vx":8.0219393078570356,"vy":0,"steer":0,"brake":0,"throttle":0.2,"lights":0},{"type":"car","id":2,"x":343.81467385856655,"y":-10.500000000002625,"heading":0,"speed":12.020458885810353,"length":4.6,"width":2,"ai_state":"cruise","vx":12.020458885810353,"vy":0,"steer":0,"brake":0,"throttle":0.2,"lights":0},{"type":"pedestrian","id":3,"x":450,"y":-12,"speed":0,"vx":0,"vy":0,"parked":false},{"type":"car","id":4,"x":706.18532614143373,"y":5.2500000000026255,"heading":3.1415926535897931,"speed":12.020458885810353,"length":4.6,"width":2,"ai_state":"cruise","vx":-12.020458885810353,"vy":1.4720816498790007e-15,"steer":0,"brake":0,"throttle":0.2,"lights":0},{"type":"tl","id":0,"x":600,"y":-8.5,"heading":1.5707963267948966,"state":"green","remain_s":21.4}],"trajectory_path":[[41.9490340449638,-1.9785324029158984,11.137700918002718],[50.376203038588166,-1.70923292752846,11.410537736915922],[59.11031345348988,-1.10129339327059,11.865265768437926],[65.086734962966531,-0.999999999999999,12]],"trajectory_edge_id":0,"obstacles":[{"id":0,"type":"car","x":106.66220670488283,"y":-1.6166956101452157,"vx":8.0219393078570356,"vy":0,"len":4.6,"wid":2},{"id":1,"type":"car","x":301.26200834714268,"y":-8.6166956101469658,"vx":12.020458885810353,"vy":0,"len":4.6,"wid":2},{"id":2,"type":"pedestrian","x":407.44733448857613,"y":-10.11669561014434,"vx":0,"vy":0,"len":0.6,"wid":0.6},{"id":3,"type":"car","x":663.63266063001,"y":7.1333043898582851,"vx":-12.020458885810353,"vy":1.4720816498790007e-15,"len":4.6,"wid":2}],"lidar":[[10,0,0],[12.124355652982143,7,0],[9,15.588457268119894,0],[6.1232339957367663e-16,10,0],[-6.9999999999999964,12.124355652982